<?xml version="1.0" encoding="UTF-8" standalone="no"?>
<!DOCTYPE template SYSTEM "template.dtd">
<template>
<title>Posix Group - SUSE</title>
<!-- <regexp>^ou=.*,</regexp> -->
<icon>images/ou.png</icon>
<description>Posix Group - SUSE</description>
<askcontainer>1</askcontainer>
<rdn>cn</rdn>
<visible>1</visible>

<objectClasses>
<objectClass id="posixGroup"></objectClass>
<objectClass id="namedObject"></objectClass>
</objectClasses>

<attributes>
<attribute id="cn">
	<display>Group</display>
	<order>1</order>
	<page>1</page>
</attribute>
<attribute id="gidNumber">
	<display>GID Number</display>
	<hint>Automatically determined</hint>
	<value>=php.GetNextNumber(/,gid)</value>
	<readonly>1</readonly>
	<order>2</order>
	<page>1</page>
	<spacer>1</spacer>
</attribute>
<attribute id="memberUid">
	<maxvalnb>10</maxvalnb>
	<display>Users</display>
	<type>Dn</type>
	<hidden>0</hidden>
	<order>3</order>
	<page>1</page>
</attribute>
</attributes>
</template>
