<?xml version="1.0" encoding="UTF-8" standalone="no"?>
<!DOCTYPE template SYSTEM "template.dtd">
<template>
<title>Samba3 Group Mapping</title>
<!-- <regexp>^ou=.*,</regexp> -->
<icon>images/ou.png</icon>
<description>New Samba3 Group Mapping</description>
<askcontainer>1</askcontainer>
<rdn>cn</rdn>
<visible>1</visible>

<objectClasses>
<objectClass id="posixGroup"></objectClass>
<objectClass id="sambaGroupMapping"></objectClass>
</objectClasses>

<attributes>
<attribute id="cn">
	<display>Group</display>
	<order>1</order>
	<page>1</page>
</attribute>
<attribute id="displayName">
	<display>Windows Name</display>
	<order>2</order>
	<page>1</page>
</attribute>
<attribute id="gidNumber">
	<display>GID Number</display>
	<hint>Automatically determined</hint>
	<value>=php.GetNextNumber(/,gid,true,(&amp;(objectClass=sambaDomain)(sambaDomainName=mysambadomain))</value>
	<readonly>1</readonly>
	<order>3</order>
	<page>1</page>
	<spacer>1</spacer>
</attribute>
<attribute id="sambaSID">
	<display>Samba SID</display>
	<option>=php.PickList(/,(objectClass=sambaDomain),sambaSID,%sambaSID% (%sambaDomainName%))</option>
	<helper>
		<id>sidsuffix</id>
		<option>=php.GetNextNumber(/,gid,false,(&amp;(objectClass=sambaDomain)(sambaDomainName=mysambadomain)),*2;+1000)</option>
	</helper>
	<post>=php.Join(-,(%sambaSID%,%sidsuffix%))</post>
	<order>4</order>
	<page>1</page>
</attribute>
<attribute id="sambaGroupType">
	<display>Samba Group Type</display>
	<option id="2">Domain Group</option>
	<option id="4">Local Group</option>
	<option id="5">Well-known Group</option>
	<value>2</value>
	<order>5</order>
	<page>1</page>
	<spacer>1</spacer>
</attribute>
<attribute id="memberUid">
	<display>Users</display>
	<type>multiselect</type>
	<option>=php.MultiList(/,(objectClass=posixAccount),uid,%cn% %uid|-4/U%,memberUid,dmdName=users:::dc=localdomain,root => cn=root; nobody => cn=nobody,cn,,,)</option>
	<value>=php.MultiList(/,(&amp;(objectClass=posixAccount)(gidNumber=29999)),uid)</value>
	<size>10</size>
	<hidden>0</hidden>
	<order>10</order>
	<page>1</page>
</attribute>
</attributes>
</template>
