<?xml version="1.0" encoding="UTF-8" standalone="no"?>
<!DOCTYPE template SYSTEM "template.dtd">
<template>
<title>Simple Security Object</title>
<!--<regexp>^ou=People,o=.*,</regexp>-->
<icon>images/user.png</icon>
<description>New Simple Security Object</description>
<askcontainer>1</askcontainer>
<rdn>userid</rdn>
<visible>1</visible>

<objectClasses>
<objectClass id="account"></objectClass>
<objectClass id="simpleSecurityObject"></objectClass>
</objectClasses>

<attributes>
<attribute id="userid">
	<display>User Name</display>
	<icon>images/uid.png</icon>
	<order>1</order>
	<page>1</page>
	<spacer>1</spacer>
</attribute>
<attribute id="userPassword">
	<display>Password</display>
	<icon>images/lock.png</icon>
	<type>password</type>
	<verify>1</verify>
	<helper>
		<display>Encryption</display>
		<id>enc</id>
		<option>blowfish</option>
		<option>clear</option>
		<option>crypt</option>
		<option>ext_des</option>
		<option>md5</option>
		<option>md5crypt</option>
		<option>sha</option>
		<option>smd5</option>
		<option>ssha</option>
		<value>md5</value>
	</helper>
	<post>=php.Password(%enc%,%userPassword%)</post>
	<order>5</order>
	<page>1</page>
</attribute>
</attributes>
</template>
